{
  "$schema": "https://json-schema.org/draft/2020-12/schema",
  "$id": "https://raw.githubusercontent.com/AIAllTheThingz/Public-Access-Agents/main/schemas/v1/artifact-record.schema.json",
  "title": "Artifact Record",
  "description": "Identifies a produced artifact, its source revision, digest, build context, provenance, and signing state.",
  "type": "object",
  "additionalProperties": false,
  "required": [
    "name",
    "type",
    "digest",
    "sourceCommit"
  ],
  "properties": {
    "name": {
      "type": "string",
      "minLength": 1,
      "description": "Human-readable artifact name."
    },
    "type": {
      "type": "string",
      "minLength": 1,
      "description": "Artifact kind, such as container-image, package, archive, executable, or standards-composition."
    },
    "digest": {
      "type": "string",
      "minLength": 1,
      "description": "Algorithm-qualified digest or another immutable integrity identifier."
    },
    "sourceCommit": {
      "type": "string",
      "minLength": 1,
      "description": "Source commit or immutable source revision."
    },
    "buildRun": {
      "type": "string",
      "minLength": 1,
      "description": "Build or CI run identifier."
    },
    "provenance": {
      "type": "string",
      "minLength": 1,
      "description": "Provenance statement or location."
    },
    "signed": {
      "type": "boolean",
      "description": "Whether the artifact carries an approved cryptographic signature."
    },
    "signatureEvidence": {
      "type": "string",
      "minLength": 1,
      "description": "Optional signature verification evidence or location."
    },
    "createdAt": {
      "type": "string",
      "format": "date-time",
      "description": "Artifact creation time in RFC 3339 form."
    },
    "limitations": {
      "type": "array",
      "items": {
        "type": "string",
        "minLength": 1
      },
      "uniqueItems": true
    },
    "schemaVersion": {
      "type": "string",
      "const": "1.0.0",
      "description": "Optional explicit instance contract version. Omitted legacy instances are interpreted as version 1.0.0."
    },
    "extensions": {
      "type": "object",
      "description": "Namespaced extension data. Extension keys must be organization- or product-specific and must not redefine standard fields.",
      "propertyNames": {
        "pattern": "^[A-Za-z][A-Za-z0-9_.-]{1,127}$"
      },
      "additionalProperties": true
    }
  },
  "x-schemaVersion": "1.0.0"
}
