{
  "schemaVersion": "1.0.0",
  "name": "example-package",
  "type": "archive",
  "digest": "sha256:0123456789abcdef",
  "sourceCommit": "0000000000000000000000000000000000000000",
  "buildRun": "example-run-001",
  "provenance": "fictitious documentation example",
  "signed": false,
  "limitations": [
    "Not a release artifact."
  ]
}
